{"id": 337, "name": "Dayton Daily News", "domain": "daytondailynews.com", "bias": "center", "credibility": "high-credibility", "reporting": "high", "questionable": null, "url": "https://www.daytondailynews.com/configsection/marketing/dayton-daily-news-digital-help-center/TT5Y5BPAVJCYRFIT4O3A4JR2BI/", "title": "Dayton Daily News Digital Help Center", "content": "ePaper Sign up for our newsletters Subscriber Benefits Digital Help Center **configsection/marketing** Local Best of Dayton Business Investigations Opinion Life Food Sports Obituaries Classifieds Legal Notices ePaper Quick LinksePaperNewslettersSubscriber BenefitsDigital Help Center ePaper Newsletters Subscriber Benefits Digital Help Center ePaper Newsletters Subscriber Benefits Digital Help Center NewsMilitary NewsNation & WorldElectionsPoliticsOhio News Military News Nation & World Elections Politics Ohio News Military News Nation & World Elections Politics Ohio News LocalCommunity GemsCrimeMental Health MattersDaily Law JournalGreene County NewsLocal School NewsMontgomery County NewsWarren County NewsMore CommunitiesTrafficWeather Community Gems Crime Mental Health Matters Daily Law Journal Greene County News Local School News Montgomery County News Warren County News More Communities Traffic Weather Community Gems Crime Mental Health Matters Daily Law Journal Greene County News Local School News Montgomery County News Warren County News More Communities Traffic Weather Business InvestigationsPath Forward. Path Forward. Path Forward. Opinion HomesPlus LifeBest of DaytonCelebrationsHealthDayton HistoryLatest PhotosLatest VideosPuzzles & GamesThings to Do Best of Dayton Celebrations Health Dayton History Latest Photos Latest Videos Puzzles & Games Things to Do Best of Dayton Celebrations Health Dayton History Latest Photos Latest Videos Puzzles & Games Things to Do Food SportsLatest ScoresTom ArchdeaconCincinnati BengalsCincinnati RedsCleveland BrownsDayton DragonsUD FlyersHigh SchoolsOSU BuckeyesWSU Raiders Latest Scores Tom Archdeacon Cincinnati Bengals Cincinnati Reds Cleveland Browns Dayton Dragons UD Flyers High Schools OSU Buckeyes WSU Raiders Latest Scores Tom Archdeacon Cincinnati Bengals Cincinnati Reds Cleveland Browns Dayton Dragons UD Flyers High Schools OSU Buckeyes WSU Raiders Obituaries ClassifiedsFind a JobCars for Sale Find a Job Cars for Sale Find a Job Cars for Sale Legal Notices Newspaper Archives Digital Help Center Sign Up for Newsletters NewsLocalObituariesWeatherOhio LotteryNIE Teacher AccessNewslettersNewspaper Archives Local Obituaries Weather Ohio Lottery NIE Teacher Access Newsletters Newspaper Archives Local Obituaries Weather Ohio Lottery NIE Teacher Access Newsletters Newspaper Archives Customer ServiceContact the Dayton Daily NewsOur ProductsFeedbackFAQsDigital Help CenterWork Here Contact the Dayton Daily News Our Products Feedback FAQs Digital Help Center Work Here Contact the Dayton Daily News Our Products Feedback FAQs Digital Help Center Work Here MarketplaceClassifiedsJobsCars for SaleHomesPlusAdvertiseLegal Notices Classifieds Jobs Cars for Sale HomesPlus Advertise Legal Notices Classifieds Jobs Cars for Sale HomesPlus Advertise Legal Notices **Dayton Daily News Digital Help Center** **General** How to subscribe to Dayton Daily News How to reach someone at the Dayton Daily News **Apps** How to download Dayton Daily News apps How to customize topics in the news feed of the Dayton Daily News app **ePaper** How to access the ePaper How to navigate the ePaper How to bookmark a page of the ePaper How to change text size of the ePaper How to print an article from the ePaper How to share an article from the ePaper How to download an edition or article How to have an article read aloud How to use the ePaper to read a back issue of the newspaper **Games & Puzzles** How to play interactive games and puzzles How to print a game or puzzle from ePaper **My Digital Account** Welcome to your digital access How to activate and log in to your digital subscription account How to manage your Dayton Daily News account online How to recover or reset a password How to update your email address or password How to share account access with a friend or family member How to scan a QR Code **Newsletters** How to subscribe to newsletters and manage your choices **Website** How to navigate DaytonDailyNews.com from main page If you have questions about how to use any of our digital products, please check out the articlesin this document. If you still have questions, feel free to contact us atcustomercare@daytondailynews.comor call us at 1-888-397-6397."}